{
  "schemaVersion": "cp.shopify-app-inventory.v1",
  "observedAt": "2026-07-22",
  "observation": {
    "source": "product-owner-observed",
    "installedStatus": "reported-installed",
    "capabilityStatus": "unverified",
    "browserAudit": "login-required",
    "blocker": {
      "code": "SHOPIFY_AUTHENTICATED_SESSION_REQUIRED",
      "humanAction": "In the preserved Shopify login tab, choose Continue with Google, select the authorized account, and complete Shopify verification if prompted. Do not share or record authentication data.",
      "resumePoint": "Resume at Shopify installed-app inventory, compare all 30 reported names, then inspect permissions and settings read-only without changing configuration or accepting fees."
    }
  },
  "apps": [
    {
      "name": "Spin Studio - 360 Product Spin",
      "category": "media",
      "goalDisposition": "duplicate-candidate",
      "ownershipFinding": "Candidate spin worker; select at most one spin owner after exact-product evidence.",
      "accessPathToVerify": "third-party-private-api-webhook-or-browser",
      "verifiedCallableSurface": "none-auth-blocked",
      "agentAuthenticationNeeded": "Authenticated Shopify Admin plus any separately issued app API credential and documented read scopes.",
      "usageFeeRisk": "cost-or-credit-unverified",
      "safeNextAction": "Inspect settings, export, provenance, billing, and Draft safety read-only; do not generate or spend credits."
    },
    {
      "name": "Modelize",
      "category": "media",
      "goalDisposition": "candidate",
      "ownershipFinding": "Candidate media worker; Media Registry remains canonical truth owner.",
      "accessPathToVerify": "third-party-private-api-webhook-or-browser",
      "verifiedCallableSurface": "none-auth-blocked",
      "agentAuthenticationNeeded": "Authenticated Shopify Admin plus app-specific API credentials if the app exposes them.",
      "usageFeeRisk": "cost-or-credit-unverified",
      "safeNextAction": "Inspect input, output, rights, provenance, credit, and export controls read-only."
    },
    {
      "name": "Apliiq - Print On Demand",
      "category": "pod-sourcing",
      "goalDisposition": "required-poc",
      "ownershipFinding": "Selected Signature Hoodie fulfillment candidate; exact variant mapping remains unverified.",
      "accessPathToVerify": "third-party-private-api-webhook-or-browser",
      "verifiedCallableSurface": "none-auth-blocked",
      "agentAuthenticationNeeded": "Authenticated Shopify Admin plus approved read-only Apliiq API or browser access.",
      "usageFeeRisk": "cost-or-credit-unverified",
      "safeNextAction": "Observe Hoodie product and variant mapping only; stop before sample, order, fulfillment, or charge."
    },
    {
      "name": "ZS-Spin-View",
      "category": "media",
      "goalDisposition": "duplicate-candidate",
      "ownershipFinding": "Alternate spin worker; must not coexist as a second customer spin owner.",
      "accessPathToVerify": "third-party-private-api-webhook-or-browser",
      "verifiedCallableSurface": "none-auth-blocked",
      "agentAuthenticationNeeded": "Authenticated Shopify Admin plus app-specific read credentials if available.",
      "usageFeeRisk": "cost-or-credit-unverified",
      "safeNextAction": "Inspect settings, rendering inputs, exportability, provenance, and billing read-only."
    },
    {
      "name": "Fraud Control",
      "category": "commerce-operations",
      "goalDisposition": "optional-later",
      "ownershipFinding": "Operational risk candidate; not part of the current Draft Hoodie build lane.",
      "accessPathToVerify": "shopify-native-admin-or-api",
      "verifiedCallableSurface": "none-auth-blocked",
      "agentAuthenticationNeeded": "Authenticated Shopify Admin; any Admin API access requires separately approved least-privilege scopes.",
      "usageFeeRisk": "shopify-plan-boundary-unverified",
      "safeNextAction": "Identify native policy and event surfaces read-only; do not change fraud rules."
    },
    {
      "name": "CodexAutomation5",
      "category": "automation-connectors",
      "goalDisposition": "candidate",
      "ownershipFinding": "Custom connector candidate only; installation proves neither Admin API scopes nor write authority.",
      "accessPathToVerify": "custom-connector-scopes",
      "verifiedCallableSurface": "none-auth-blocked",
      "agentAuthenticationNeeded": "Authenticated Shopify Admin plus read-only inspection of granted OAuth/Admin scopes and callback configuration; no credential values.",
      "usageFeeRisk": "cost-or-credit-unverified",
      "safeNextAction": "Inspect app details and granted scope names read-only, then run only a separately approved non-mutating capability probe."
    },
    {
      "name": "Messaging",
      "category": "customer-operations",
      "goalDisposition": "duplicate-candidate",
      "ownershipFinding": "Support inbox candidate; select one owner with Tidio after privacy and escalation review.",
      "accessPathToVerify": "unknown-browser-or-private-api",
      "verifiedCallableSurface": "none-auth-blocked",
      "agentAuthenticationNeeded": "Authenticated Shopify Admin and any app-specific inbox API or dashboard authorization.",
      "usageFeeRisk": "cost-or-credit-unverified",
      "safeNextAction": "Inspect access, retention, escalation, export, and billing read-only; do not contact customers."
    },
    {
      "name": "Gelato: Print on Demand",
      "category": "pod-sourcing",
      "goalDisposition": "duplicate-candidate",
      "ownershipFinding": "Provider alternate; not a co-owner of Hoodie fulfillment.",
      "accessPathToVerify": "third-party-private-api-webhook-or-browser",
      "verifiedCallableSurface": "none-auth-blocked",
      "agentAuthenticationNeeded": "Authenticated Shopify Admin plus separately approved provider API credentials if available.",
      "usageFeeRisk": "cost-or-credit-unverified",
      "safeNextAction": "Inspect category fit and mapping surface read-only; keep inactive for the Hoodie."
    },
    {
      "name": "CustomCat: Print on Demand",
      "category": "pod-sourcing",
      "goalDisposition": "duplicate-candidate",
      "ownershipFinding": "Provider alternate; one provider per approved product or category.",
      "accessPathToVerify": "third-party-private-api-webhook-or-browser",
      "verifiedCallableSurface": "none-auth-blocked",
      "agentAuthenticationNeeded": "Authenticated Shopify Admin plus separately approved provider API credentials if available.",
      "usageFeeRisk": "cost-or-credit-unverified",
      "safeNextAction": "Inspect category fit and auto-order defaults read-only; do not enable fulfillment."
    },
    {
      "name": "CJdropshipping: Much Faster",
      "category": "pod-sourcing",
      "goalDisposition": "duplicate-candidate",
      "ownershipFinding": "Sourcing alternate with no current Hoodie role.",
      "accessPathToVerify": "third-party-private-api-webhook-or-browser",
      "verifiedCallableSurface": "none-auth-blocked",
      "agentAuthenticationNeeded": "Authenticated Shopify Admin plus separately approved provider account/API access.",
      "usageFeeRisk": "cost-or-credit-unverified",
      "safeNextAction": "Record available surfaces and cost gates read-only; leave unselected."
    },
    {
      "name": "Spreadconnect",
      "category": "pod-sourcing",
      "goalDisposition": "duplicate-candidate",
      "ownershipFinding": "Provider alternate with no current Hoodie ownership.",
      "accessPathToVerify": "third-party-private-api-webhook-or-browser",
      "verifiedCallableSurface": "none-auth-blocked",
      "agentAuthenticationNeeded": "Authenticated Shopify Admin plus separately approved provider API credentials if available.",
      "usageFeeRisk": "cost-or-credit-unverified",
      "safeNextAction": "Inspect category fit and mapping surface read-only; do not create or sync products."
    },
    {
      "name": "Zendrop - Dropshipping & POD",
      "category": "pod-sourcing",
      "goalDisposition": "duplicate-candidate",
      "ownershipFinding": "Sourcing alternate; must not duplicate another provider owner.",
      "accessPathToVerify": "third-party-private-api-webhook-or-browser",
      "verifiedCallableSurface": "none-auth-blocked",
      "agentAuthenticationNeeded": "Authenticated Shopify Admin plus separately approved provider account/API access.",
      "usageFeeRisk": "cost-or-credit-unverified",
      "safeNextAction": "Inspect plan, mapping, and order automation defaults read-only; leave inactive."
    },
    {
      "name": "Tidio - Live Chat & Chatbots",
      "category": "customer-operations",
      "goalDisposition": "duplicate-candidate",
      "ownershipFinding": "Support inbox candidate; select one owner with Messaging.",
      "accessPathToVerify": "third-party-private-api-webhook-or-browser",
      "verifiedCallableSurface": "none-auth-blocked",
      "agentAuthenticationNeeded": "Authenticated Shopify Admin plus app dashboard/API authorization.",
      "usageFeeRisk": "reported-usage-fees",
      "safeNextAction": "Inspect permissions, retention, escalation, AI controls, and usage fees read-only; do not message."
    },
    {
      "name": "Marketplace Connect",
      "category": "commerce-operations",
      "goalDisposition": "optional-later",
      "ownershipFinding": "Channel candidate; no Draft product syndication authority.",
      "accessPathToVerify": "shopify-native-admin-or-api",
      "verifiedCallableSurface": "none-auth-blocked",
      "agentAuthenticationNeeded": "Authenticated Shopify Admin plus channel-specific authorization if configured.",
      "usageFeeRisk": "shopify-plan-boundary-unverified",
      "safeNextAction": "Inspect connected channels and fee boundaries read-only; do not sync listings."
    },
    {
      "name": "Search & Discovery",
      "category": "commerce-operations",
      "goalDisposition": "candidate",